Id,ProductId,UserId,ProfileName,HelpfulnessNumerator,HelpfulnessDenominator,Score,Time,Summary,Text
1,B001E4KFG0,A3SGXH7AUHU8GW,Delmar,1,1,5,1303862400,Good Quality Dog Food,I have bought several of the Vitality canned dog food products and have found them all to be of good quality.
2,B00813GRG4,A1D87F6ZCVE5NK,dll pa,0,0,1,1346976000,Not as Advertised,Product arrived labeled as Jumbo Salted Peanuts but the peanuts were actually small sized unsalted.
3,B000LQOCH0,ABXLMWJIXXAIN,Natalia Corres,0,0,4,1219017600,Delight says it all,This is a confection that has been around a few centuries. It is light and delicious.
4,B000UA0QIQ,A395BORC6FGVXV,Karl,1,1,5,1307923200,Cough Medicine,"This is 10 cough drops, not 10 packs of cough drops as stated on the box."
5,B006K2ZZ7K,A1UQRSCLF8GW1T,C. Glover,1,1,5,1350777600,Great taffy,Great taffy at a great price. There was a wide assortment of yummy taffy.
